<?xml version="1.0" encoding="UTF-8"?>
<?xml-stylesheet type="text/xsl" href="../xslt/fuentes-to-html.xsl"?>
<!DOCTYPE unidades_alimentacion SYSTEM "fuentes.dtd">
<unidades_alimentacion tienda="JB" >
    <inventario categoria="Fuentes de Alimentación" fechaActualizacion="2026-02-13">

        <fabricante nombre="ASUS">
            <fuente id="PSU_ASU_001" gama="ROG Strix" modular="true" disponible="true">
                <modelo>ASUS ROG Strix 750G</modelo>
                <especificaciones>
                    <potencia unidad="W">750</potencia>
                    <certificacion>80+ Gold</certificacion>
                </especificaciones>
                <precio moneda="EUR">149.00</precio>
                <estado>15</estado>
                <fechaRegistro>2025-06-10</fechaRegistro>
            </fuente>

            <fuente id="PSU_ASU_002" gama="ROG Strix" modular="true" disponible="true">
                <modelo>ASUS ROG Strix 850G</modelo>
                <especificaciones>
                    <potencia unidad="W">850</potencia>
                    <certificacion>80+ Gold</certificacion>
                </especificaciones>
                <precio moneda="EUR">169.00</precio>
                <estado>10</estado>
                <fechaRegistro>2025-06-10</fechaRegistro>
            </fuente>

            <fuente id="PSU_ASU_003" gama="ROG Strix" modular="true" disponible="true">
                <modelo>ASUS ROG Strix 1000G</modelo>
                <especificaciones>
                    <potencia unidad="W">1000</potencia>
                    <certificacion>80+ Gold</certificacion>
                </especificaciones>
                <precio moneda="EUR">209.00</precio>
                <estado>8</estado>
                <fechaRegistro>2025-06-10</fechaRegistro>
            </fuente>

            <fuente id="PSU_ASU_004" gama="ROG Thor" modular="true" disponible="true">
                <modelo>ASUS ROG Thor 850P</modelo>
                <especificaciones>
                    <potencia unidad="W">850</potencia>
                    <certificacion>80+ Platinum</certificacion>
                </especificaciones>
                <precio moneda="EUR">249.00</precio>
                <estado>5</estado>
                <fechaRegistro>2025-11-20</fechaRegistro>
            </fuente>

            <fuente id="PSU_ASU_005" gama="ROG Thor" modular="true" disponible="true">
                <modelo>ASUS ROG Thor 1000P</modelo>
                <especificaciones>
                    <potencia unidad="W">1000</potencia>
                    <certificacion>80+ Platinum</certificacion>
                </especificaciones>
                <precio moneda="EUR">299.00</precio>
                <estado>4</estado>
                <fechaRegistro>2025-11-20</fechaRegistro>
            </fuente>

            <fuente id="PSU_ASU_006" gama="ROG Thor" modular="true" disponible="true">
                <modelo>ASUS ROG Thor 1200P</modelo>
                <especificaciones>
                    <potencia unidad="W">1200</potencia>
                    <certificacion>80+ Platinum</certificacion>
                </especificaciones>
                <precio moneda="EUR">369.00</precio>
                <estado>3</estado>
                <fechaRegistro>2025-11-20</fechaRegistro>
            </fuente>

            <fuente id="PSU_ASU_007" gama="TUF Gaming" modular="false" disponible="true">
                <modelo>ASUS TUF Gaming 550B</modelo>
                <especificaciones>
                    <potencia unidad="W">550</potencia>
                    <certificacion>80+ Bronze</certificacion>
                </especificaciones>
                <precio moneda="EUR">69.00</precio>
                <estado>30</estado>
                <fechaRegistro>2025-04-15</fechaRegistro>
            </fuente>

            <fuente id="PSU_ASU_008" gama="TUF Gaming" modular="false" disponible="true">
                <modelo>ASUS TUF Gaming 650B</modelo>
                <especificaciones>
                    <potencia unidad="W">650</potencia>
                    <certificacion>80+ Bronze</certificacion>
                </especificaciones>
                <precio moneda="EUR">79.00</precio>
                <estado>25</estado>
                <fechaRegistro>2025-04-15</fechaRegistro>
            </fuente>

            <fuente id="PSU_ASU_009" gama="TUF Gaming" modular="true" disponible="true">
                <modelo>ASUS TUF Gaming 750G</modelo>
                <especificaciones>
                    <potencia unidad="W">750</potencia>
                    <certificacion>80+ Gold</certificacion>
                </especificaciones>
                <precio moneda="EUR">119.00</precio>
                <estado>18</estado>
                <fechaRegistro>2025-10-05</fechaRegistro>
            </fuente>

            <fuente id="PSU_ASU_010" gama="ROG Loki" modular="true" disponible="true">
                <modelo>ASUS ROG Loki SFX-L</modelo>
                <especificaciones>
                    <potencia unidad="W">850</potencia>
                    <certificacion>80+ Platinum</certificacion>
                </especificaciones>
                <precio moneda="EUR">229.00</precio>
                <estado>7</estado>
                <fechaRegistro>2026-01-12</fechaRegistro>
            </fuente>
        </fabricante>

        <fabricante nombre="Corsair">
            <fuente id="PSU_COR_001" gama="RMx" modular="true" disponible="true">
                <modelo>Corsair RM750x</modelo>
                <especificaciones>
                    <potencia unidad="W">750</potencia>
                    <certificacion>80+ Gold</certificacion>
                </especificaciones>
                <precio moneda="EUR">129.00</precio>
                <estado>40</estado>
                <fechaRegistro>2025-08-14</fechaRegistro>
            </fuente>

            <fuente id="PSU_COR_002" gama="RMx" modular="true" disponible="true">
                <modelo>Corsair RM850x</modelo>
                <especificaciones>
                    <potencia unidad="W">850</potencia>
                    <certificacion>80+ Gold</certificacion>
                </especificaciones>
                <precio moneda="EUR">149.00</precio>
                <estado>30</estado>
                <fechaRegistro>2025-08-14</fechaRegistro>
            </fuente>

            <fuente id="PSU_COR_003" gama="RMx" modular="true" disponible="true">
                <modelo>Corsair RM1000x</modelo>
                <especificaciones>
                    <potencia unidad="W">1000</potencia>
                    <certificacion>80+ Gold</certificacion>
                </especificaciones>
                <precio moneda="EUR">189.00</precio>
                <estado>15</estado>
                <fechaRegistro>2025-08-14</fechaRegistro>
            </fuente>

            <fuente id="PSU_COR_004" gama="HXi" modular="true" disponible="true">
                <modelo>Corsair HX1000i</modelo>
                <especificaciones>
                    <potencia unidad="W">1000</potencia>
                    <certificacion>80+ Platinum</certificacion>
                </especificaciones>
                <precio moneda="EUR">239.00</precio>
                <estado>10</estado>
                <fechaRegistro>2025-12-05</fechaRegistro>
            </fuente>

            <fuente id="PSU_COR_005" gama="HXi" modular="true" disponible="true">
                <modelo>Corsair HX1500i</modelo>
                <especificaciones>
                    <potencia unidad="W">1500</potencia>
                    <certificacion>80+ Platinum</certificacion>
                </especificaciones>
                <precio moneda="EUR">329.00</precio>
                <estado>5</estado>
                <fechaRegistro>2025-12-05</fechaRegistro>
            </fuente>

            <fuente id="PSU_COR_006" gama="AX" modular="true" disponible="true">
                <modelo>Corsair AX1600i</modelo>
                <especificaciones>
                    <potencia unidad="W">1600</potencia>
                    <certificacion>80+ Titanium</certificacion>
                </especificaciones>
                <precio moneda="EUR">519.00</precio>
                <estado>2</estado>
                <fechaRegistro>2025-03-20</fechaRegistro>
            </fuente>

            <fuente id="PSU_COR_007" gama="SF" modular="true" disponible="true">
                <modelo>Corsair SF750</modelo>
                <especificaciones>
                    <potencia unidad="W">750</potencia>
                    <certificacion>80+ Platinum</certificacion>
                </especificaciones>
                <precio moneda="EUR">169.00</precio>
                <estado>12</estado>
                <fechaRegistro>2025-07-10</fechaRegistro>
            </fuente>

            <fuente id="PSU_COR_008" gama="CX" modular="false" disponible="true">
                <modelo>Corsair CX550</modelo>
                <especificaciones>
                    <potencia unidad="W">550</potencia>
                    <certificacion>80+ Bronze</certificacion>
                </especificaciones>
                <precio moneda="EUR">59.00</precio>
                <estado>50</estado>
                <fechaRegistro>2025-01-15</fechaRegistro>
            </fuente>

            <fuente id="PSU_COR_009" gama="CX" modular="false" disponible="true">
                <modelo>Corsair CX650</modelo>
                <especificaciones>
                    <potencia unidad="W">650</potencia>
                    <certificacion>80+ Bronze</certificacion>
                </especificaciones>
                <precio moneda="EUR">69.00</precio>
                <estado>45</estado>
                <fechaRegistro>2025-01-15</fechaRegistro>
            </fuente>

            <fuente id="PSU_COR_010" gama="RM" modular="true" disponible="false">
                <modelo>Corsair RM750e</modelo>
                <especificaciones>